{
  "manifestVersion": 1,
  "generatedAtUtc": "2026-04-22T00:11:10.174613+00:00",
  "sourceDirectory": "/Users/yasminluengo/Downloads/plusswfs",
  "entries": [
    {
      "assetId": "hh_room_ads_crush",
      "sourceFilename": "hh_room_ads_crush.swf",
      "roomKey": "ads_crush",
      "variantKey": "default",
      "classification": "canonical",
      "conversionStatus": "inventory_only",
      "brandTags": [],
      "localeTags": [],
      "notes": [
        "No variant markers detected from filename."
      ],
      "swfMetadata": null
    },
    {
      "assetId": "hh_room_ballroom",
      "sourceFilename": "hh_room_ballroom.swf",
      "roomKey": "ballroom",
      "variantKey": "default",
      "classification": "canonical",
      "conversionStatus": "inventory_only",
      "brandTags": [],
      "localeTags": [],
      "notes": [
        "No variant markers detected from filename."
      ],
      "swfMetadata": null
    },
    {
      "assetId": "hh_room_bar",
      "sourceFilename": "hh_room_bar.swf",
      "roomKey": "bar",
      "variantKey": "default",
      "classification": "canonical",
      "conversionStatus": "inventory_only",
      "brandTags": [],
      "localeTags": [],
      "notes": [
        "No variant markers detected from filename."
      ],
      "swfMetadata": null
    },
    {
      "assetId": "hh_room_bar_ing",
      "sourceFilename": "hh_room_bar_ING.swf",
      "roomKey": "bar_ing",
      "variantKey": "default",
      "classification": "canonical",
      "conversionStatus": "inventory_only",
      "brandTags": [],
      "localeTags": [],
      "notes": [
        "No variant markers detected from filename."
      ],
      "swfMetadata": null
    },
    {
      "assetId": "hh_room_bar_ing2",
      "sourceFilename": "hh_room_bar_ING2.swf",
      "roomKey": "bar_ing2",
      "variantKey": "default",
      "classification": "canonical",
      "conversionStatus": "inventory_only",
      "brandTags": [],
      "localeTags": [],
      "notes": [
        "No variant markers detected from filename."
      ],
      "swfMetadata": null
    },
    {
      "assetId": "hh_room_beauty_salon_garnier",
      "sourceFilename": "hh_room_beauty_salon_garnier.swf",
      "roomKey": "beauty_salon",
      "variantKey": "garnier",
      "classification": "brand_variant",
      "conversionStatus": "inventory_only",
      "brandTags": [
        "garnier"
      ],
      "localeTags": [],
      "notes": [],
      "swfMetadata": null
    },
    {
      "assetId": "hh_room_beauty_salon_general",
      "sourceFilename": "hh_room_beauty_salon_general.swf",
      "roomKey": "beauty_salon_general",
      "variantKey": "default",
      "classification": "canonical",
      "conversionStatus": "inventory_only",
      "brandTags": [],
      "localeTags": [],
      "notes": [
        "No variant markers detected from filename."
      ],
      "swfMetadata": null
    },
    {
      "assetId": "hh_room_beauty_salon_libra",
      "sourceFilename": "hh_room_beauty_salon_libra.swf",
      "roomKey": "beauty_salon",
      "variantKey": "libra",
      "classification": "brand_variant",
      "conversionStatus": "inventory_only",
      "brandTags": [
        "libra"
      ],
      "localeTags": [],
      "notes": [],
      "swfMetadata": null
    },
    {
      "assetId": "hh_room_branded",
      "sourceFilename": "hh_room_branded.swf",
      "roomKey": "branded",
      "variantKey": "default",
      "classification": "canonical",
      "conversionStatus": "inventory_only",
      "brandTags": [],
      "localeTags": [],
      "notes": [
        "No variant markers detected from filename."
      ],
      "swfMetadata": null
    },
    {
      "assetId": "hh_room_branded_chupa",
      "sourceFilename": "hh_room_branded_chupa.swf",
      "roomKey": "branded",
      "variantKey": "chupa",
      "classification": "brand_variant",
      "conversionStatus": "inventory_only",
      "brandTags": [
        "chupa"
      ],
      "localeTags": [],
      "notes": [],
      "swfMetadata": null
    },
    {
      "assetId": "hh_room_branded_dragon",
      "sourceFilename": "hh_room_branded_dragon.swf",
      "roomKey": "branded_dragon",
      "variantKey": "default",
      "classification": "canonical",
      "conversionStatus": "inventory_only",
      "brandTags": [],
      "localeTags": [],
      "notes": [
        "No variant markers detected from filename."
      ],
      "swfMetadata": null
    },
    {
      "assetId": "hh_room_branded_iceage",
      "sourceFilename": "hh_room_branded_iceage.swf",
      "roomKey": "branded",
      "variantKey": "iceage",
      "classification": "brand_variant",
      "conversionStatus": "inventory_only",
      "brandTags": [
        "iceage"
      ],
      "localeTags": [],
      "notes": [],
      "swfMetadata": null
    },
    {
      "assetId": "hh_room_branded_percy",
      "sourceFilename": "hh_room_branded_percy.swf",
      "roomKey": "branded",
      "variantKey": "percy",
      "classification": "brand_variant",
      "conversionStatus": "inventory_only",
      "brandTags": [
        "percy"
      ],
      "localeTags": [],
      "notes": [],
      "swfMetadata": null
    },
    {
      "assetId": "hh_room_brcroate",
      "sourceFilename": "hh_room_brcroate.swf",
      "roomKey": "brcroate",
      "variantKey": "default",
      "classification": "canonical",
      "conversionStatus": "inventory_only",
      "brandTags": [],
      "localeTags": [],
      "notes": [
        "No variant markers detected from filename."
      ],
      "swfMetadata": null
    },
    {
      "assetId": "hh_room_brgrefusa",
      "sourceFilename": "hh_room_brgrefusa.swf",
      "roomKey": "brgrefusa",
      "variantKey": "default",
      "classification": "canonical",
      "conversionStatus": "inventory_only",
      "brandTags": [],
      "localeTags": [],
      "notes": [
        "No variant markers detected from filename."
      ],
      "swfMetadata": null
    },
    {
      "assetId": "hh_room_cafe",
      "sourceFilename": "hh_room_cafe.swf",
      "roomKey": "cafe",
      "variantKey": "default",
      "classification": "canonical",
      "conversionStatus": "inventory_only",
      "brandTags": [],
      "localeTags": [],
      "notes": [
        "No variant markers detected from filename."
      ],
      "swfMetadata": null
    },
    {
      "assetId": "hh_room_cafe_xms08",
      "sourceFilename": "hh_room_cafe_xms08.swf",
      "roomKey": "cafe",
      "variantKey": "xms08",
      "classification": "seasonal_variant",
      "conversionStatus": "inventory_only",
      "brandTags": [],
      "localeTags": [],
      "notes": [
        "Seasonal markers detected: xms08"
      ],
      "swfMetadata": null
    },
    {
      "assetId": "hh_room_chill",
      "sourceFilename": "hh_room_chill.swf",
      "roomKey": "chill",
      "variantKey": "default",
      "classification": "canonical",
      "conversionStatus": "inventory_only",
      "brandTags": [],
      "localeTags": [],
      "notes": [
        "No variant markers detected from filename."
      ],
      "swfMetadata": null
    },
    {
      "assetId": "hh_room_cinema",
      "sourceFilename": "hh_room_cinema.swf",
      "roomKey": "cinema",
      "variantKey": "default",
      "classification": "canonical",
      "conversionStatus": "inventory_only",
      "brandTags": [],
      "localeTags": [],
      "notes": [
        "No variant markers detected from filename."
      ],
      "swfMetadata": null
    },
    {
      "assetId": "hh_room_clubmammoth",
      "sourceFilename": "hh_room_clubmammoth.swf",
      "roomKey": "clubmammoth",
      "variantKey": "default",
      "classification": "canonical",
      "conversionStatus": "inventory_only",
      "brandTags": [],
      "localeTags": [],
      "notes": [
        "No variant markers detected from filename."
      ],
      "swfMetadata": null
    },
    {
      "assetId": "hh_room_den",
      "sourceFilename": "hh_room_den.swf",
      "roomKey": "den",
      "variantKey": "default",
      "classification": "canonical",
      "conversionStatus": "inventory_only",
      "brandTags": [],
      "localeTags": [],
      "notes": [
        "No variant markers detected from filename."
      ],
      "swfMetadata": null
    },
    {
      "assetId": "hh_room_disco",
      "sourceFilename": "hh_room_disco.swf",
      "roomKey": "disco",
      "variantKey": "default",
      "classification": "canonical",
      "conversionStatus": "inventory_only",
      "brandTags": [],
      "localeTags": [],
      "notes": [
        "No variant markers detected from filename."
      ],
      "swfMetadata": null
    },
    {
      "assetId": "hh_room_disco_nokia",
      "sourceFilename": "hh_room_disco_nokia.swf",
      "roomKey": "disco",
      "variantKey": "nokia",
      "classification": "brand_variant",
      "conversionStatus": "inventory_only",
      "brandTags": [
        "nokia"
      ],
      "localeTags": [],
      "notes": [],
      "swfMetadata": null
    },
    {
      "assetId": "hh_room_disco_nokia_x6",
      "sourceFilename": "hh_room_disco_nokia_x6.swf",
      "roomKey": "disco_x6",
      "variantKey": "nokia",
      "classification": "brand_variant",
      "conversionStatus": "inventory_only",
      "brandTags": [
        "nokia"
      ],
      "localeTags": [],
      "notes": [],
      "swfMetadata": null
    },
    {
      "assetId": "hh_room_dustylounge",
      "sourceFilename": "hh_room_dustylounge.swf",
      "roomKey": "dustylounge",
      "variantKey": "default",
      "classification": "canonical",
      "conversionStatus": "inventory_only",
      "brandTags": [],
      "localeTags": [],
      "notes": [
        "No variant markers detected from filename."
      ],
      "swfMetadata": null
    },
    {
      "assetId": "hh_room_emperors",
      "sourceFilename": "hh_room_emperors.swf",
      "roomKey": "emperors",
      "variantKey": "default",
      "classification": "canonical",